author,text,published_at,like_count,sentiment_compound,sentiment_pos,sentiment_neu,sentiment_neg
@edmondgreene4814,"I made 135k as a general manager of a fast food restaurant with no degree in 2023, the opportunities are out there if you're willing to set yourself apart from the average mediocre American worker. My wife made 70k and stopped working at the end of July that year to raise our daughter.",2025-06-24T00:26:38Z,0,-0.128,0.048,0.875,0.076
@0601989m,"Top-notch animation, sound design and storytelling. One of the most pertinent JH videos so far. Keep it up folks!!!",2025-06-24T00:25:15Z,1,0.0,0.0,1.0,0.0
@TheFlyingHambone,i voted for Bernie Sanders and will vote for AOC as president as far as right now goes. This country is a scam at the moment.,2025-06-24T00:22:12Z,0,-0.5719,0.0,0.861,0.139
@benbuzbee,This is amazing Johnny exactly what needed to be shown,2025-06-24T00:20:01Z,0,0.5859,0.297,0.703,0.0
@FerristotheBueller,"Kids, it's the federal reserve, the printing of money, and debt. It all leads back to that! It's not the rich lmaoooo",2025-06-24T00:16:52Z,0,-0.6923,0.0,0.778,0.222
@dannyschwertner7785,"Love the graph of low/middle/top income earners and their share of the prosperity generated. Conveniently left out that people often jump upward on those lines as they get expertise and knowledge. Sure you might ride the low income line for a few years while you're getting some experience and then you bounce up to the mid and if you're good at that, bounce up to the higher income. How much were people are retiring with in each of those time periods?",2025-06-24T00:14:38Z,0,0.8591,0.131,0.846,0.024
@atirpok3,"“We have the power to pressure them to design a system that is fair.” Hahaha you’re kidding, right? We have ZERO power. Nice sentiment though.",2025-06-24T00:11:56Z,0,0.6808,0.26,0.667,0.073
@theungoliant9410,You are grossly oversimplifying things.,2025-06-24T00:02:54Z,0,-0.2263,0.0,0.678,0.322
@edwardlinne2156,Corporate and government greed lured women into the work force to get more tax money.  Much of the money lined fat cat politicians pockets.  Germany and Japan rebuilt their factories so by the 70s  slow mediocre American products could not sell.  In the 80s China started going into overdrive to strip America of our factories.  Just adding some things for context.,2025-06-23T23:58:58Z,0,-0.4019,0.0,0.957,0.043
@Josesitolapaz,"I’m 25, i have 5 jobs. Live in a room in nyc. my fam in jersey think im rich but everything’s so expensive so i don’t have it to feel at peace or even take a week or two off (im a dancer / teacher/ work in nightlife) so rest is necessary and time for creativity which i don’t have.",2025-06-23T23:54:56Z,0,0.8873,0.176,0.824,0.0
@itsnotthatserious2291,Literally why are these homes so damn expensive???,2025-06-23T23:52:53Z,0,-0.6163,0.0,0.635,0.365
@theungoliant9410,"Why don't you work the math? If all these CEOs that are getting so much more money than us peons gave us their income 2 divided evenly amongst us, how much more would each of us make?",2025-06-23T23:51:16Z,0,0.0,0.0,1.0,0.0
@Noumenon4Idolatry,Someone else always had it better.  That’s most people.,2025-06-23T23:45:54Z,0,0.4404,0.266,0.734,0.0
@theregularviking-eg2od,"It's interesting to note that the 1960's wasn't investigated more fully. The cultural revolution, JFK's assassination, and LBJ's Social Security Amendments act all were huge contributors to the economic quagmire we live in today. To my mind, this decade set the stage for things like Enron, Bernie Madoff, and a ton of others that I'm not mentioning or have yet to be caught. I understand that it's a cultural tightrope to walk this line, but maybe everyone is wrong. In the 1950's, blacks from the West Indies were doing fantastic (and still are). Quite frankly (not to sound too ethereal) I think it goes back to Magna Carta. If everyone is subject to the law (including the King or what have you), then what has been done since... a while ago (I'm not going there as it would take too long) is to just make so many laws, amendments, etc. that the definition of what the law defines is so muddied that it could mean anything. And that (obviously) points at the last few years concerning everything to..... well, you know what I'm saying (hopefully). Great video! Cheers!",2025-06-23T23:43:13Z,0,0.9537,0.122,0.846,0.032
@hoangvietho,"The american dream is not looking like a myth, it's looking like a nightmare",2025-06-23T23:38:04Z,0,-0.3004,0.131,0.591,0.277
@dejaliloquy,thank you for this video!,2025-06-23T23:20:48Z,0,0.4199,0.411,0.589,0.0
@Chemicallybondedformations,"You got to play by the games that the rich do. You got to invest where they invest and you got to to play the games that they play. You won't make it out of the hole. If you don't! My daughter will be much better off than I will. In fact, I'm pretty sure she's already better off than I am and I retired at 34. She'll probably be there by the time she graduates college. She currently works at Starbucks. I worked as a technician on an average wage. It can be done, you just have to sacrifice now for a better life later.",2025-06-23T23:19:01Z,0,0.9729,0.217,0.783,0.0
@ChrisLeonard-np7lh,The more money top managers made the worse working conditions got. Turns out that smarty pants with the MBA couldn’t manage a fart after a baked bean supper.,2025-06-23T23:16:53Z,0,0.0202,0.138,0.76,0.102
@tibofinds3726,Trickle down does not work if all the money these companies are making goes to overseas investment and outsourcing.  It’s all about reducing costs and increasing revenue.  CEOs and companies are not incentivized to hire more or be more philanthropical.  It’s not a problem that the gov’t can fix by patchwork aid programs.,2025-06-23T23:11:42Z,0,0.3089,0.042,0.958,0.0
@colinfountain59,"There are a number of factors this does not consider. If all the wealth of the top income earners was distributed tot he low and median income earners, how much difference would it actually make to their incomes? We have to keep in mind that the percentage of people in the high income category is very small so once this money is divided up to so many, it likely isn't going to make a lot of difference. Also the definition of productivity needs to be looked at. In a service based economy, most supposed productivity is just paper shuffling that doesn't actually produce any real wealth. It doesn't build houses, cars or furniture or provide us with health that we consider our most cherished possessions.",2025-06-23T23:08:25Z,0,0.8748,0.1,0.884,0.016
@byoung4310,Thanks Boomers,2025-06-23T23:06:05Z,0,0.4404,0.744,0.256,0.0
@rich7447,"Increasing automation means that more gets done with fewer workers. The jobs that aren't heavily automated are moved to lower cost locations. This means that there is more competition for the jobs at the bottom and in the middle, but more demand for those able to manage a more complex business environment.",2025-06-23T23:03:29Z,0,-0.4194,0.0,0.928,0.072
@bl9531,"Really, who cares who had it better … it’s not like we can choose to go back 😂",2025-06-23T23:02:25Z,0,0.621,0.29,0.611,0.099
@neyedol,"$84,000 house held together with lead and mesothelioma. No one talks about the cost of progressive safety regulation.",2025-06-23T22:55:25Z,0,0.1531,0.133,0.762,0.105
@Nuonerew,"If a corporation receives government subsidies, and those subsidies are paid from what pot of money? Taxes, correct? So wouldn’t that mean that each tax payer is owed a portion of the profits? Or a share of the company? Does these subsidies get repaid to the government?",2025-06-23T22:54:23Z,0,0.7236,0.126,0.874,0.0
@davestory8614,"Just to be clear: the Top/Middle/Bottom groups are not static. Over their lifetime, a person will climb the economic ladder. Also, the top 1% always changes year-to-year  (this is a peak that few people sustain). But prosperity is shared by all, if not evenly, but everyone (on average) has been better off than those a decade or two before them. Also, on poverty: US capitalism has proven that no matter how much assistance you provide to individuals, a certain amount will fail at basic responsibilities.",2025-06-23T22:52:11Z,0,-0.2617,0.142,0.735,0.123
@lucaswouters3029,"I wish you would have added the increase of national debt to other countries. I know this would make it even more complicated, but it would have been interesting to see if that would have been similar to other trends.",2025-06-23T22:48:30Z,0,0.6486,0.165,0.794,0.041
@ChrisLeonard-np7lh,"In the Seventies I worked as a nurses aide to put myself through college. My tuition was $250/quarter at a state school. I made $2.50 an hour. I paid $50/month to rent a third floor room. I could afford a nice used cars, a Gran Torino. I took 2 week long vacations to CA.
Things were starting to fall apart though. Here’s the story of the Rust Belt where I lived in the Seventies and early Eighties. Billy Joel’s Allentown.
https://youtu.be/BHnJp0oyOxs?si=AmZcIA43jSmLbV0k",2025-06-23T22:45:34Z,0,0.4215,0.04,0.96,0.0
@ChrisLeonard-np7lh,You look kinda like Raul Esparza.,2025-06-23T22:43:23Z,0,0.2975,0.306,0.694,0.0
@Sgab1007,"Excellent video. I like the conclusions at the end and the encouragement to further change in our society by placing pressure on politicians. Democracy is power to the people. Politicians serve us, not the other way around.",2025-06-23T22:41:12Z,0,0.7783,0.208,0.741,0.051
@ChrisLeonard-np7lh,"In 1956 my single mom who worked as a clerk and part time bookkeeper in a drug store bought a small but nice 2 BR in a great suburb outside Cleveland for 11K. She bought a new Ford Falcon in 1960. We took vacations to Chicago, Niagara Falls, Wisconsin Dells. Parochial school was free. We played outside and rode our bikes all over town.",2025-06-23T22:29:49Z,0,0.9578,0.238,0.762,0.0
