author,text,published_at,like_count,sentiment_compound,sentiment_pos,sentiment_neu,sentiment_neg
@johnnyharris,Get an exclusive 15% discount on Saily data plans! Use code johnnyharris at checkout. Download Saily app or go to https://saily.com/johnnyharris,2025-06-17T13:52:42Z,192,0.2003,0.082,0.918,0.0
@cheese7119,The fact that I knew all of this before you said it cuz I had exam from it c: yesterday,2025-06-24T09:11:08Z,0,0.0,0.0,1.0,0.0
,"When you every time yell communism on the slightest hint of social agenda for 70 years, well...",2025-06-24T09:09:56Z,0,0.0,0.0,1.0,0.0
@luke-vc7re,"When you show the image at 23:10 it makes me think how much coke, crack and fentanyl was floating round in the 50s. What about a graph showing drug imports into the US and inequality? Or %of Americans regularly using drugs vs poverty?",2025-06-24T09:01:17Z,0,-0.5661,0.0,0.918,0.082
@Michael.Freeman,Fantastic but sad. Hi from Australia where the dream has gone. Buying a home means debt slavery for life 😢,2025-06-24T08:51:50Z,0,-0.9062,0.15,0.408,0.442
@LeonardLeon,oh. This whole video is actually one word: reaganomics. Reagan's policies in a few charts. And now Trump will make it even worse.,2025-06-24T08:51:35Z,0,-0.4767,0.0,0.871,0.129
@gecko2000405,This guy has 6.7 Million subs and says he needs ads in his video.,2025-06-24T08:40:56Z,0,0.0,0.0,1.0,0.0
@samedhaarora7048,I think Nixon shock was such a big turning point in world economy. In the 90s and 00s it mostly prospered with the tech boom so I think we have reached the saturation point now,2025-06-24T08:39:49Z,0,-0.296,0.041,0.882,0.076
@damncars2618,A 90% tax rate for billionaires will fix it.,2025-06-24T08:38:24Z,0,0.0,0.0,1.0,0.0
@neotropos,"Like for like living standards against real wages (after inflation and decades of currency debasement) have plummeted. That much is obvious. 
Why? Well, the individual reasons are varied and complex - they include things like the abolition of the Gold Standard, the rise of technologies, 'post-modern' modes of thinking and globalisation. 
Perhaps it can simply be summed up as the multi-organ collapse of civilisation.",2025-06-24T08:31:51Z,0,0.6597,0.136,0.819,0.045
@stekon9112,"Can  we compare? They didnt have iphones, flat tv, and many things. We dont have stability.",2025-06-24T07:42:50Z,0,0.0,0.0,1.0,0.0
@sadhu4624,people who just lost their youth and early adulthood in WW2 deserved to get a home (for free in my view even) and live comfortably for the rest of their lives. The fact that no one thought this thru enough so that we end up were we are now is a great mirror of society. Always go for the short term benefits,2025-06-24T07:28:12Z,0,0.8519,0.18,0.757,0.063
@crazygermanviper,Strangely my parents still disagree.,2025-06-24T06:38:51Z,0,-0.5859,0.0,0.385,0.615
@nelseify,"In 1955 they didnt take 3-5 holidays per year, didn't pay 2x car payments per family, didnt buy a new cell phone every 2 years, didn't have broadband, cell phone, cable, streaming subscriptions, they didn't eat out 3 times a week, which we all see as neccessary... tell me again who had the better quality of life??",2025-06-24T06:28:13Z,0,0.3339,0.08,0.881,0.038
@chartedtravel1776,"wait till AI when productivity is going to moon and salaries will stay same, because one person controls 50 robots",2025-06-24T06:23:57Z,0,0.0,0.0,1.0,0.0
@jeetqt,The yugioh lifepoints sound effect on the money is fire,2025-06-24T06:18:30Z,0,-0.34,0.0,0.789,0.211
@josefarrington,"Reaganomics, my friend.",2025-06-24T06:17:36Z,0,0.4939,0.615,0.385,0.0
@davidarundel6187,"Same story in New Zealand , and Australia .",2025-06-24T06:14:54Z,0,0.0,0.0,1.0,0.0
@deosyx6,3:34 ; thats the YU GI OH life point sounds!!,2025-06-24T06:13:35Z,0,0.0,0.0,1.0,0.0
@leiferikson4279,"Dawg, what is this video? This is just all misinformation. How about you do a video looking at real inflation numbers instead of the BS we have here.",2025-06-24T05:59:22Z,0,-0.3182,0.0,0.919,0.081
@lanemcnally5159,"So is this video just a hit piece on the rich? You suggest pressuring our politicians into creating a fairer system.. so what sort of ideas do you have? Apart from me feeling disdain for the top earners of our country, as well as feeling wronged by our politicians and lawmakers, what is the purpose of this video? Thank you for compiling charts and graphs designed to support a narrative that I and most other Americans are being F-ed over. I'd honestly appreciate some ideas you have to solve the problems you showcased. What sort of systematic and political changes do you recommend we pressure our politicians into implementing?",2025-06-24T05:45:02Z,0,0.9111,0.222,0.676,0.102
@masington56,It’s actually worse than this because this doesn’t account for debt at all.,2025-06-24T05:35:52Z,0,-0.6808,0.0,0.663,0.337
@kszakonyi,"You needed to include the late 70’s and early 80’s when interest rates on homes were about 16% and people were losing their homes because of adjustable rates.  Entire neighborhoods were decimated.  Virtually everything doubled in price except of course wages, and unemployment was extremely high.  If you take about 1987 to maybe 1984 you would have a very real comparison to what is going on today.  Eventually in the 90’s the salaries were up and things settled down, but you missed showing the actual impact of what was going on.  People seem to think  boomers had everything given to them.  No, it was very similar to what is going on today and we couldn’t afford homes either for a long time.",2025-06-24T05:35:34Z,0,-0.7469,0.016,0.91,0.074
@JoyJones-ph2kh,"Stop saying the US is a democracy. A representative democracy is no longer because corporations have replaced American votes with lobbying.

 On another note, if the people have no say in their government, we are also no longer a Republic.

 Stop calling the US a democracy and actually what it's been since its founding; a plutocratic oligarchy, turned full-blown corporate oligarchy.",2025-06-24T05:33:30Z,0,-0.8519,0.0,0.803,0.197
@garretcooper4852,It's almost like this is what happens when un restricted capitalism. It's almost like the rich people all figured out the stock market at the same time.🤯🤯🤯 the playing stupid and blaming it on something other than the inevitable end to uncapped capitalism looks ignorant.,2025-06-24T05:23:53Z,0,-0.4117,0.165,0.64,0.195
@bankutsuuzumaki8534,9:32 how bro? nah it wasnt better in the 70s if according to your own vid a 1 income household was fine in the 50s to support an entire family and that became more difficult in the 70s = worse in the 70s! One of the biggest deals there being housing costs as you also show going from 84k to 230k.. thats almost triple with worse interests... its just worse overall in the 70s which is correct btw kinda odd you came to the opposite conclusion tho! You even mention why its so good in the 50s! its the 92% tax rate on the rich! Basically the solution is very simple; Tax the damn rich!,2025-06-24T04:31:16Z,0,-0.4647,0.129,0.713,0.158
@lukasritzer738,TLDR: No,2025-06-24T04:29:23Z,0,-0.296,0.0,0.312,0.688
@ebwholesaler,"Was living with $ 158 / month in 1984
Today, NEED $ 8,000 / month !!!
What will it be at my retirement ? (they plan me for roughly 3,000...)",2025-06-24T04:28:32Z,1,0.0,0.0,1.0,0.0
@gsstilo57805,"We are in a better situations nowadays.   in the 50s blacks and Mexicans and other minorities had an awful opportunity to grow financially.  Now I'm Mexican American in the 2000s 2010s 2025s. My parents were ""poor"" and with will and sweat and pain I now live in High Middle Class in California making 200k a year. We are better  nowadays. Survival of the fittest.",2025-06-24T04:15:56Z,0,0.3182,0.121,0.79,0.089
@garyfrancis6193,Ay yes. In college in 1978 I rented a room in a big old two story house downtown. It had enough rooms to rent out two more upstairs and landlady lived at the back on the first floor. She was Latvian and didn’t speak much English and by then had retired as part of the cleaning staff at the General hospital. She told me once she had bought the house in 1952 for $7000 and paid it off in 5 years. That house is still there but she is gone as she was about 70 in 1978. Now $7000 would  be your monthly mortgage payment.  It’s not that prices went up. The value of your money has decreased since 1952 by 80%. What would have cost $1 in 1952 costs $20 now and rising as your dollar keeps shrinking in value to nothing. What it amounts to is that you likely worked to get that money that is becoming more worthless every day. You can’t take back your labour so you are basically being robbed of its past value until you have nothing. In the past people bought real estate to hedge their savings against inflation and live in it too. But taxes on it and insurance kept rising and house prices kept rising relative to incomes until it is increasingly unaffordable to more and more people. That means of preserving the value of their savings is now unavailable as their money keeps dropping in value. Now big business is looking at replacing hundreds of thousands or millions of workers with AI and robots. So you won’t have income anymore. Forget about UBI. No one will be paying income tax because they will have no jobs. Where would UBI money come from? That’s the future you are facing now. What happens when people have no jobs to go to and have nothing to lose?,2025-06-24T04:10:54Z,0,0.6765,0.062,0.893,0.045
@ericroll,"Trickle Down Economics at work. Remember when politicians no longer used the words ""rich"" or ""wealthy"" to describe a person?  Tax breaks went to the wealthy, not because they were rich, but because they were ""job creators"".  The downward trend for middle-income earners that began in the early 1980s wasn't too obvious because families went from 1 income to 2 incomes in order to maintain their lifestyle. Credit card use also became quite popular as a way to mask the downward spiral.",2025-06-24T04:08:08Z,0,0.8747,0.134,0.847,0.019
@jubiliejoy1845,Back in the 70s there was a recession. My dad was in the middle class upper middle class in the 60s and we had whatever we wanted even at Christmas. Then came the 70s and the recession. My father was laid off from his high paying job and had to take work at a factory. It was Columbia Records. Life changed at my home. They had to buy a smaller cheaper home. My dad eventually got his job back but a substantial pay cut. My  father was getting older and had lost his seniority during his factory job. They were hiring younger workers at lower pay. Life was never again the same for us. You can only say the economy was great in 70s unless you lived through them. Lots of people lost their jobs and one way or another had pay cuts. There were gas shortages and also race riots in my high school. Before your next video study your history.,2025-06-24T04:05:36Z,1,-0.9455,0.043,0.796,0.161
@eduardodebrovnik3678,"This doesn’t explain everything, but you have a pretty glaring omission in that household size has dropped quite a bit over time, so you need to correct for that in your household income graph which, as far as I can tell, you didn’t.",2025-06-24T03:56:23Z,0,0.6486,0.099,0.901,0.0
@JoaoFerreira-lk3rt,So no mention to neoliberalism? hmm,2025-06-24T03:50:06Z,0,-0.3597,0.0,0.667,0.333
@guitarpick335,"Looks like AI is the only solution going forward.  All people including high paid elite will be affected.

The average worker from the 1950s’ will be much better after AI takes over most jobs and levels the playing field…  Stay tuned.

It’s going to be fantastic.  No more inequality!",2025-06-24T03:49:26Z,1,0.8622,0.226,0.71,0.064
@crawdadad,"If the income disparity is due to government policy decisions then why is the same income inequality happening in India, China, Germany and Nigeria?  I picked these countries randomly and ran them through Perplexity and same trends. I also asked about Brazil and Perplexity said that they bucked the trend recently. Of course it said that Brazil was already one of the top countries in income inequality and wealth disparity already. 

Economic growth vs Individual living standards. Everyone has a cellphone. We all live longer. Lots of babies survive today due to medical care for premature babies. We have a much larger state. When I was growing up the air was polluted, rivers were flammable, playground equipment and cars were deadly and our houses were filled with poisonous materials. Our pesticides were killing us and everything else. Larger, much more. In nominal dollars federal government expenditures, not even counting entitlements, is 71x!  And you didn’t even mention the creation of Medicare. Spending on Social Security and Medicare are now HUNDREDS of times greater!  A lot of the income disparity is being offset by government spending.
You said that women entering the workforce was necessary. Not sure about that. All sexes of all racial groups are now competing for the same jobs. And immigration is off the charts compared to 1955. I feel like you’re telling a story, but not THE story. 
Social security outlays in billions 
1955 $7.8 
1960 $11.2
1970 $30.9
1980 $118.6
1990 $248.6
2000 $409.4
2010 $706.7
2020 $1906
2024 $1458

The rich aren’t getting all that money.",2025-06-24T03:45:20Z,0,0.911,0.089,0.879,0.032
@lostsou5555555,"Check out ""wtf happened in 1971""",2025-06-24T03:38:43Z,0,-0.5859,0.0,0.568,0.432
@despairdx,"there is a simple answer why is government influenced by rich people.
Top earners earn 400x more and they make agreement by paying very high tax % so it's a win-win for both rich and gov. It's an unbreakable relationship and I highly doubt it will ever be broken.",2025-06-24T03:34:35Z,0,0.7436,0.214,0.683,0.103
@crawdadad,"If the income disparity is due to government policy decisions then why is the same income inequality happening in India, China, Germany and Nigeria?  I picked these countries randomly and ran them through Perplexity and same trends. I also asked about Brazil and Perplexity said that they bucked the trend recently. Of course it said that Brazil was already one of the top countries in income inequality and wealth disparity already. 

Economic growth vs Individual living standards. Everyone has a cellphone. We all live longer. Lots of babies survive today due to medical care for premature babies. We have a much larger state. When I was growing up the air was polluted, rivers were flammable, playground equipment and cars were deadly and our houses were filled with poisonous materials. Our pesticides were killing us and everything else. Larger, much more. In nominal dollars federal government expenditures, not even counting entitlements, is 71x!  And you didn’t even mention the creation of Medicare. Spending on Social Security and Medicare are now HUNDREDS of times greater!  A lot of the income disparity is being offset by government spending.
You said that women entering the workforce was necessary. Not sure about that. All sexes of all racial groups are now competing for the same jobs. And immigration is off the charts compared to 1955. I feel like you’re telling a story, but not THE story.",2025-06-24T03:29:57Z,0,0.5504,0.069,0.895,0.036
@AetherisPoeta,socialist propoganda,2025-06-24T03:23:59Z,0,0.0,0.0,1.0,0.0
@0p3randi,2025 and it's not even close,2025-06-24T02:54:20Z,0,0.0,0.0,1.0,0.0
@Nuonerew,"Yes, the citizens of the USA bear the cost of US government subsidies. 
Here's how:
Taxpayer Funding: Government subsidies are funded by taxpayer money, collected through various forms of taxation. In effect, citizens' tax payments contribute to the resources that are then allocated as subsidies.
Borrowing: If a subsidy program is financed through government borrowing, the costs are borne by future taxpayers, including the interest payments associated with the debt.
Economic Impact: The act of funding subsidies through taxes or borrowing can have negative economic effects on individuals and businesses, impacting their working, investing, and entrepreneurial activities. 
In essence, citizens, as taxpayers, ultimately provide the funds for government subsidies, and their economic activities can be affected by the costs and potential economic distortions associated with these programs.",2025-06-24T02:52:04Z,0,-0.2732,0.042,0.9,0.058
@Nuonerew,"US government subsidies are financial assistance programs that provide support to individuals, businesses, or industries to achieve specific economic or social goals. These subsidies can take the form of direct cash payments, tax breaks, or other forms of support. They are often intended to encourage certain activities, offset costs, or promote specific sectors of the economy. 
Here's a more detailed explanation:
Purpose:
Subsidies are used to influence market outcomes, encourage specific behaviors, or address market failures. They can be used to make goods and services more affordable, stimulate economic activity, or support industries deemed important for national security or public well-being.",2025-06-24T02:50:00Z,0,0.9627,0.219,0.756,0.025
@GOATPoets,"6.74 million subscribers, white, and raised with both parents ... Johnny is a top earner.",2025-06-24T02:47:08Z,0,0.2023,0.122,0.878,0.0
@nappiral,Nixon officially took us off the gold standard in 1971 and it took a decade or two to really start to gather steam and continue hollowing out the middle class for the next 5 decades and running.  When they print money out of thin air ( and governments eventually always do) they are stealing from all our collective efforts and shared prosperity.  Cantillionaires,2025-06-24T02:42:05Z,0,-0.3182,0.037,0.905,0.058
@HichigoShirosaki1,"This doesn't pinpoint the exact time the graphs diverge at which point is the root cause, which would show how to reverse it. What I can say, though, is that automation, telecommunications, women in the workforce, and the baby boom are the primary causes because more workers, whether automated, outsourced, or adding more people to the workforce, mean more supply mean less pay per person and not everyone was in a household with another person to mitigate that. Simply put, productivity mainly benefits the rich because they make more profit the more goods their businesses move which is the exact sane concept as gdp. VOLUME = $$$. That is basic business economics. When they could only choose from suitable men to do jobs and can't outsource to somewhere cheaper, take the men out of the equation through automation, and can't decide to just hire a woman, they don't have leverage for cheaper labor. That is part of why tarrifs are actually a solid idea to mitigate some of it.

 There are several graphs you could have shown to better analyze the issue that goes over the actual economics involved. This video sounds more like an overview rather than an actual analysis, which is needed to really answer the question. 

Another point here as well is that this is just looking at numbers, not the people themselves. The numbers changing do not necessarily mean it is more difficult. Some people are outliers, but it's why they are outliers that matter.",2025-06-24T02:41:57Z,0,0.796,0.056,0.932,0.012
@northerniltree,No one told Al Capone the American Dream was a myth.,2025-06-24T02:27:39Z,0,-0.0516,0.164,0.656,0.18
@descai10,"The thing is, the houses wouldn't have these prices if there wasn't someone to buy it at that price. Who is paying such absurd prices for these homes? I think the problem might be mortgages and people making bad choices to buy homes with the highest loan they can get accepted for.",2025-06-24T02:15:03Z,1,-0.6249,0.037,0.853,0.11
@kencito3,"guys came from war, worked in a factory, had a small house, but they were the kings... life is so unfair now... 
go get to the army and go to a war then stop crying.",2025-06-24T02:08:09Z,0,-0.9692,0.0,0.572,0.428
@manderse12,"Very helpful.  Thank you.  ...But there are four sets of really important details missing from your account that would allow people to ACT ON this information: 
1) Which policies exactly made this wealth disparity a reality?  
2) What are the alternative policies that we can feasibly push through congress (given the imbalance in real lobbying power that exists today)?
3) What about the sustainability picture (i.e., all the hidden costs that are buried in the economic data that mask the damage we have done--and will continue to do--to the natural environment that makes life possible)?  Economists have always obscured and papered over these hidden costs--like pollution, greenhouse gases in the atmosphere, biodiversity and habitat loss--that affect us now and all future generations of living organisms.  (Humans are not the only species that matter for measuring well-being, of course.) 
4) What does a truly sustainable economy look like (because pretending that we could alter policies that improve only human well-being is a lie that we can't afford to believe anymore).",2025-06-24T02:04:32Z,0,0.9551,0.147,0.815,0.037
@peterhuynh8780,do you play Yu-Gi-Oh?,2025-06-24T01:58:21Z,0,0.34,0.444,0.556,0.0
@ivanandreevich8568,You should never use household income because the size of the household changes and especially it changes between different income brackets. This is the fundamental flaw of this video. Please refer to Thomas Sowell on this.,2025-06-24T01:57:34Z,0,0.3182,0.062,0.938,0.0
@scotpetri7630,My best times was the 90s.,2025-06-24T01:51:01Z,0,0.6369,0.457,0.543,0.0
@scatpackkeezy9117,Basically they start cheating us in the 1960s and just turned up from there,2025-06-24T01:44:03Z,0,-0.5574,0.0,0.783,0.217
@chrisbenson5380,Move me to 55 please,2025-06-24T01:41:01Z,0,0.3182,0.365,0.635,0.0
@kaitlin8562,"Amazing data. Tax wealth, not work!",2025-06-24T01:30:22Z,0,0.807,0.646,0.354,0.0
@coyote5.046,They all got greedy and that is what killed this country,2025-06-24T01:24:21Z,0,-0.7783,0.0,0.57,0.43
@josephlinehan2281,Everything is trumps fault though.   .,2025-06-24T01:21:15Z,0,-0.4019,0.0,0.597,0.403
@NotforProfit,"21:35
1944 - The Bretton Woods system is established.
1971 - Nixon ends the Bretton Woods system.",2025-06-24T01:19:05Z,0,0.0,0.0,1.0,0.0
@letsreasonthisout2898,"You have the power to push the politicians...

🤣",2025-06-24T01:17:51Z,0,0.0,0.0,1.0,0.0
@lukek1949,"Reaganonics was largely the problem, but it was really just a few components of Reaganomics that were extremely bad. It is import ant to have an incentive society, but a few things should never have been allowed. One of the worst policies was deregulation of banking. That largely led to the 2008 financial crisis, and the public through money printing and inflation had to pay for it. Another really bad policy was the allowing of big corporations to hoard money (like buying back shares). There was little incentive to invest when the economy was bad (thus making things worse). The government largely did that and therefore more money printing and inflation. 

Congress is bought and sold. Time to start over.",2025-06-24T01:15:57Z,1,-0.9795,0.045,0.748,0.208
@NotforProfit,"1944 - Bretton Woods system established.
1971 - Nixon ends Bretton Woods system.
21:35",2025-06-24T01:15:00Z,0,0.0,0.0,1.0,0.0
@LilyWasHereMB,"Oh Johnny. If you think the United States is still a democracy, you learned nothing from your 1980 onwards data.",2025-06-24T01:14:02Z,0,0.4215,0.135,0.865,0.0
@NotforProfit,"1944 - The Bretton Woods system is established.
""Gold Standard 🪙""

1971 - Nixon ends the Bretton Woods system. 
""Fiat money🎉🎉🎉""


The money in your pocket is actually tied to what you produce.
People and governments can't game the system so easily.

Vs,

Money is now backed by nothing other than government promises, and the weathly elites that controle them.
21:35",2025-06-24T01:12:56Z,0,0.7019,0.109,0.891,0.0
@0601989m,"Optimists: taxing the 1% could still get us out of this mess.
Pessimists: system is fucked. Vote for a billionaire TV personality instead.
Realists: how did 1917 become an option again?",2025-06-24T01:06:10Z,1,-0.7701,0.069,0.686,0.245
@josephlinehan2281,The problem with modern dollars is that there is no clearly conversion factor thst isn't manipulated.,2025-06-24T01:02:13Z,0,-0.0041,0.224,0.551,0.225
@nedgoldreyer8761,"The only answer is revolution, but the middle class and even most of the working class are still too comfortable to risk losing what they have by engaging in armed conflicted, and it's in the interest of the wealthy to keep it this way. We inhabit a situation allowing the wealthy to continue as they are while providing the under classes with just enough entertainment and the illusion of unattainable betterment that they will never actually take any substantial action to alter the status quo. Electing to anesthetize ourselves via screens, sugar and cheap chemical depressants ensures things remain as they are. It isn't a horrible disaster, it's just living in a state of permanent dissatisfaction brought on by thwarted hopes.",2025-06-24T01:01:10Z,1,0.9703,0.231,0.672,0.097
@TexasRiverRat31254,"I was born in 1954 and lived through the good times until the 80's when people bought into ""Trickle Down Economics"". It was a lie then that those at the top would use their increased wealth from tax ""relief"" to create well paying jobs for those near the middle and bottom. It's still a lie now.",2025-06-24T00:46:41Z,0,0.9042,0.232,0.768,0.0
@k.p.3739,During the times that the income flatlined for anyone but the top earners the Americans had the Democrats ruling. The American economy was always best used a republican leader. Just saying .,2025-06-24T00:40:19Z,0,0.8402,0.222,0.778,0.0
